{
  "action_id": "WF-EXAMPLE-001:1:ANALYSIS-001:dispatch_send:1",
  "action_type": "dispatch_send",
  "task_id": "ANALYSIS-001",
  "controller_thread_id": "controller-example",
  "controller_host_id": "local",
  "controller_epoch": 1,
  "attempt": 1,
  "status": "prepared",
  "payload": {"threadId": "example-thread", "hostId": "local", "dispatch_id": "ANALYSIS-001-exampledispatch", "dispatch_path": "D:\\example-project\\.codex-orchestrator\\dispatches\\ANALYSIS-001-exampledispatch.json"},
  "payload_sha256": "aaaaaaaaaaaaaaaaaaaaaaaaaaaaaaaaaaaaaaaaaaaaaaaaaaaaaaaaaaaaaaaa",
  "receipt_path": null,
  "receipt_sha256": null,
  "message_id": null,
  "cursor": null,
  "resolution_evidence_path": null,
  "resolution_evidence_sha256": null,
  "created_at": "2026-09-15T00:00:00+08:00",
  "completed_at": null,
  "cancelled_at": null
}
